{"$defs":{"TokenBudget":{"additionalProperties":false,"properties":{"context_window_tokens":{"minimum":1,"title":"Context Window Tokens","type":"integer"},"hard_constraint_tokens":{"minimum":0,"title":"Hard Constraint Tokens","type":"integer"},"planned_input_tokens":{"minimum":0,"title":"Planned Input Tokens","type":"integer"},"reserved_output_tokens":{"minimum":1,"title":"Reserved Output Tokens","type":"integer"},"status":{"enum":["fits","exceeds"],"title":"Status","type":"string"}},"required":["context_window_tokens","reserved_output_tokens","planned_input_tokens","hard_constraint_tokens","status"],"title":"TokenBudget","type":"object"},"TruncationItem":{"additionalProperties":false,"properties":{"field_path":{"maxLength":300,"minLength":1,"title":"Field Path","type":"string"},"original_tokens":{"minimum":0,"title":"Original Tokens","type":"integer"},"policy":{"enum":["preserved","summarized","omitted","rejected"],"title":"Policy","type":"string"},"reason":{"maxLength":1000,"minLength":1,"title":"Reason","type":"string"},"retained_tokens":{"minimum":0,"title":"Retained Tokens","type":"integer"}},"required":["field_path","policy","original_tokens","retained_tokens","reason"],"title":"TruncationItem","type":"object"},"TruncationReport":{"additionalProperties":false,"properties":{"content_sha256":{"pattern":"^[0-9a-f]{64}$","title":"Content Sha256","type":"string"},"hard_constraints_preserved":{"title":"Hard Constraints Preserved","type":"boolean"},"items":{"items":{"$ref":"#/$defs/TruncationItem"},"maxItems":1000,"title":"Items","type":"array"},"report_id":{"format":"uuid","title":"Report Id","type":"string"},"schema_version":{"const":"1.0","default":"1.0","title":"Schema Version","type":"string"},"version":{"minimum":1,"title":"Version","type":"integer"}},"required":["report_id","version","hard_constraints_preserved","content_sha256"],"title":"TruncationReport","type":"object"}},"$id":"https://manga-maker.local/contracts/v0.3/text-stage-run.schema.json","$schema":"https://json-schema.org/draft/2020-12/schema","additionalProperties":false,"properties":{"capability_snapshot_id":{"format":"uuid","title":"Capability Snapshot Id","type":"string"},"capability_snapshot_sha256":{"pattern":"^[0-9a-f]{64}$","title":"Capability Snapshot Sha256","type":"string"},"chapter_id":{"format":"uuid","title":"Chapter Id","type":"string"},"checkpoint_id":{"anyOf":[{"format":"uuid","type":"string"},{"type":"null"}],"default":null,"title":"Checkpoint Id"},"content_sha256":{"pattern":"^[0-9a-f]{64}$","title":"Content Sha256","type":"string"},"input_sha256":{"pattern":"^[0-9a-f]{64}$","title":"Input Sha256","type":"string"},"output_sha256":{"anyOf":[{"pattern":"^[0-9a-f]{64}$","type":"string"},{"type":"null"}],"default":null,"title":"Output Sha256"},"prompt_template_version":{"maxLength":100,"minLength":1,"title":"Prompt Template Version","type":"string"},"schema_version":{"const":"1.0","default":"1.0","title":"Schema Version","type":"string"},"shard_count":{"minimum":1,"title":"Shard Count","type":"integer"},"shard_index":{"minimum":0,"title":"Shard Index","type":"integer"},"stage":{"enum":["adaptation","world_bible","character_tags","prompt_plan"],"title":"Stage","type":"string"},"state":{"enum":["planned","running","completed","failed","needs_review","cancelled"],"title":"State","type":"string"},"text_stage_run_id":{"format":"uuid","title":"Text Stage Run Id","type":"string"},"token_budget":{"$ref":"#/$defs/TokenBudget"},"truncation_report":{"$ref":"#/$defs/TruncationReport"},"version":{"minimum":1,"title":"Version","type":"integer"}},"required":["text_stage_run_id","version","chapter_id","stage","state","shard_index","shard_count","capability_snapshot_id","capability_snapshot_sha256","token_budget","prompt_template_version","input_sha256","truncation_report","content_sha256"],"title":"TextStageRun","type":"object"}
